{
  "type":"object",
  "$schema":"http://json-schema.org/draft-03/schema",
  "id":"#",
  "required":true,
  "properties":{
    "asset":{
      "type":"array",
      "id":"asset",
      "required":true,
      "items":{
        "type":"object",
        "id":"0",
        "required":true,
        "properties":{
          "description":{
            "type":"string",
            "id":"description",
            "required":true
          },
          "name":{
            "type":"string",
            "id":"name",
            "required":true
          },
          "type":{
            "type":"string",
            "id":"type",
            "required":true
          }
        }
      }

    },
    "improvement":{
      "type":"array",
      "id":"improvement",
      "required":true,
      "items":[
        {
          "type":"object",
          "id":"0",
          "required":true,
          "properties":{
            "cost":{
              "type":"object",
              "id":"cost",
              "required":true,
              "properties":{
                "min_turns":{
                  "type":"number",
                  "id":"min_turns",
                  "required":true
                }
              }
            },
            "description":{
              "type":"string",
              "id":"description",
              "required":true
            },
            "effect":{
              "type":"object",
              "id":"effect",
              "required":true,
              "properties":{
                "terrain":{
                  "type":"string",
                  "id":"terrain",
                  "required":true
                }
              }
            },
            "name":{
              "type":"string",
              "id":"name",
              "required":true
            },
            "prerequisites":{
              "type":"object",
              "id":"prerequisites",
              "required":true,
              "properties":{
                "terrain":{
                  "type":"array",
                  "id":"terrain",
                  "required":true,
                  "items":{
                    "type":"string",
                    "id":"0",
                    "required":true
                  }

                }
              }
            },
            "type":{
              "type":"string",
              "id":"type",
              "required":true
            }
          }
        },
        {
          "type":"object",
          "id":"1",
          "required":true,
          "properties":{
            "cost":{
              "type":"object",
              "id":"cost",
              "required":true,
              "properties":{
                "skill":{
                  "type":"object",
                  "id":"skill",
                  "required":true,
                  "properties":{
                    "building":{
                      "type":"number",
                      "id":"building",
                      "required":true
                    },
                    "zlaying":{
                      "type":"number",
                      "id":"zlaying",
                      "required":true
                    }
                  }
                }
              }
            },
            "description":{
              "type":"string",
              "id":"description",
              "required":true
            },
            "effect":{
              "type":"object",
              "id":"effect",
              "required":true,
              "properties":{
                "terrain":{
                  "type":"string",
                  "id":"terrain",
                  "required":true
                }
              }
            },
            "name":{
              "type":"string",
              "id":"name",
              "required":true
            },
            "prerequisites":{
              "type":"object",
              "id":"prerequisites",
              "required":true,
              "properties":{
                "terrain":{
                  "type":"array",
                  "id":"terrain",
                  "required":true,
                  "items":{
                    "type":"string",
                    "id":"0",
                    "required":true
                  }

                }
              }
            },
            "type":{
              "type":"string",
              "id":"type",
              "required":true
            }
          }
        },
        {
          "type":"object",
          "id":"2",
          "required":true,
          "properties":{
            "cost":{
              "type":"object",
              "id":"cost",
              "required":true,
              "properties":{
                "skill":{
                  "type":"object",
                  "id":"skill",
                  "required":true,
                  "properties":{
                    "farming":{
                      "type":"number",
                      "id":"farming",
                      "required":true
                    }
                  }
                }
              }
            },
            "description":{
              "type":"string",
              "id":"description",
              "required":true
            },
            "effect":{
              "type":"object",
              "id":"effect",
              "required":true,
              "properties":{
                "improvement":{
                  "type":"string",
                  "id":"improvement",
                  "required":true
                }
              }
            },
            "name":{
              "type":"string",
              "id":"name",
              "required":true
            },
            "prerequisites":{
              "type":"object",
              "id":"prerequisites",
              "required":true,
              "properties":{
                "terrain":{
                  "type":"array",
                  "id":"terrain",
                  "required":true,
                  "items":{
                    "type":"string",
                    "id":"0",
                    "required":true
                  }

                }
              }
            },
            "type":{
              "type":"string",
              "id":"type",
              "required":true
            }
          }
        },
        {
          "type":"object",
          "id":"3",
          "required":true,
          "properties":{
            "cost":{
              "type":"object",
              "id":"cost",
              "required":true,
              "properties":{
                "min_turns":{
                  "type":"number",
                  "id":"min_turns",
                  "required":true
                },
                "skill":{
                  "type":"object",
                  "id":"skill",
                  "required":true,
                  "properties":{
                    "farming":{
                      "type":"number",
                      "id":"farming",
                      "required":true
                    }
                  }
                }
              }
            },
            "description":{
              "type":"string",
              "id":"description",
              "required":true
            },
            "effect":{
              "type":"object",
              "id":"effect",
              "required":true,
              "properties":{
                "improvement":{
                  "type":"string",
                  "id":"improvement",
                  "required":true
                }
              }
            },
            "name":{
              "type":"string",
              "id":"name",
              "required":true
            },
            "prerequisites":{
              "type":"object",
              "id":"prerequisites",
              "required":true,
              "properties":{
                "blocked":{
                  "type":"boolean",
                  "id":"blocked",
                  "required":true
                }
              }
            },
            "type":{
              "type":"string",
              "id":"type",
              "required":true
            }
          }
        },
        {
          "type":"object",
          "id":"4",
          "required":true,
          "properties":{
            "cost":{
              "type":"object",
              "id":"cost",
              "required":true,
              "properties":{
                "max_turns":{
                  "type":"number",
                  "id":"max_turns",
                  "required":true
                },
                "skill":{
                  "type":"object",
                  "id":"skill",
                  "required":true,
                  "properties":{
                    "farming":{
                      "type":"number",
                      "id":"farming",
                      "required":true
                    }
                  }
                }
              }
            },
            "description":{
              "type":"string",
              "id":"description",
              "required":true
            },
            "effect":{
              "type":"object",
              "id":"effect",
              "required":true,
              "properties":{
                "assets":{
                  "type":"object",
                  "id":"assets",
                  "required":true,
                  "properties":{
                    "comment":{
                      "type":"string",
                      "id":"comment",
                      "required":true
                    },
                    "food":{
                      "type":"number",
                      "id":"food",
                      "required":true
                    }
                  }
                }
              }
            },
            "name":{
              "type":"string",
              "id":"name",
              "required":true
            },
            "prerequisites":{
              "type":"object",
              "id":"prerequisites",
              "required":true,
              "properties":{
                "blocked":{
                  "type":"boolean",
                  "id":"blocked",
                  "required":true
                }
              }
            },
            "type":{
              "type":"string",
              "id":"type",
              "required":true
            }
          }
        }
      ]
    },
    "skills":{
      "type":"array",
      "id":"skills",
      "required":true,
      "items":{
        "type":"object",
        "id":"0",
        "required":true,
        "properties":{
          "description":{
            "type":"string",
            "id":"description",
            "required":true
          },
          "model":{
            "type":"string",
            "id":"model",
            "required":true
          },
          "name":{
            "type":"string",
            "id":"name",
            "required":true
          },
          "type":{
            "type":"string",
            "id":"type",
            "required":true
          }
        }
      }

    },
    "terrain":{
      "type":"array",
      "id":"terrain",
      "required":true,
      "items":{
        "type":"object",
        "id":"0",
        "required":true,
        "properties":{
          "description":{
            "type":"string",
            "id":"description",
            "required":true
          },
          "name":{
            "type":"string",
            "id":"name",
            "required":true
          },
          "type":{
            "type":"string",
            "id":"type",
            "required":true
          }
        }
      }

    }
  }
}
