{
  "improvement":[
    {
      "type":"look_at_area",
      "name":"Look at area",
      "description":"Look at stuff.",
      "prerequisites":{
        "terrain":["grass"]
      },
      "cost":{
        "min_turns":5
      },
      "effect":{
        "terrain":"watched_grass"
      }
    },
    {
      "type":"secure_area",
      "name":"Secure area",
      "description":"Build a zombie-proofish fence around a tile and kill all zombies within.",
      "prerequisites":{
        "terrain":["grass"]
      },
      "cost":{
        "skill":{
          "zlaying":100,
          "building":100
        }
      },
      "effect":{
        "terrain":"fenced_grass"
      }
    },
    {
      "type":"field_plant",
      "name":"Plant field",
      "description":"Plow a patch of land and plant some beets.",
      "prerequisites":{
        "terrain":["field"]
      },
      "cost":{
        "skill":{
          "farming":100
        }
      },
      "effect":{
        "improvement":"field_tend"
      }
    },
    {
      "type":"field_tend",
      "name":"Tend field",
      "description":"Tend a patch of land and weed some beets.",
      "prerequisites":{
        "blocked":true
      },
      "cost":{
        "skill":{
          "farming":10
        },
        "min_turns":5
      },
      "effect":{
        "improvement":"field_harvest"
      }
    },
    {
      "type":"field_harvest",
      "name":"Harvest field",
      "description":"Harvest a patch of land and get some beets.",
      "prerequisites":{
        "blocked":true
      },
      "cost":{
        "skill":{
          "farming":100
        },
        "max_turns":2
      },
      "effect":{
        "assets":{
          "food":300,
          "comment":"We'll need to figure out the details later."
        }
      }
    }
  ],
  "terrain":[
    {
      "type":"field",
      "name":"Field",
      "description":"A patch of land where some beets are growing."
    },
    {
      "type":"fenced_grass",
      "name":"Fenced grass",
      "description":"A patch of land surrounded by wicked looking barbed wire fence. Some zombie bits are stuck in it"
    },
    {
      "type":"grass",
      "name":"Grass",
      "description":"A patch of green grass, untouched by the zombie apocalypse."
    },
    {
      "type":"water",
      "name":"Water",
      "description":"A patch of blue water, untouched by the zombie apocalypse."
    },
    {
      "type":"hills",
      "name":"Hills",
      "description":"A patch of high hill, untouched by the zombie apocalypse."
    }
  ],
  "asset":[
    {
      "type":"food",
      "name":"Food",
      "description":"Some generic post-apocalyptic food. The taste is indescribable (because there isn't any) and the contents is mostly beets."
    }
  ],
  "skills":[
    {
      "type":"zlaying",
      "name":"Et cetera",
      "description":"et cetera",
      "model":"linear"
    }
  ]
}